{
  "verdict": "PASS",
  "scores": {
    "coverage": 5, "granularity": 4, "ordering": 4, "verifiability": 4,
    "parallelization": 4, "checkpoints": 4, "traceability": 5
  },
  "coverage": {
    "upstream_coverage_pct": 100.0,
    "notes": "inventory 5 项逐份对照上游登记:arch 模块表 M1、契约 C3、schema 两表、module exposes、工程支撑项各归其位;范围内无漏拆。分母与百分比照抄 validate.py 输出。"
  },
  "strengths": [
    "纵切扎实:PHASE-1 终点是可演示的端到端下单,不是半成品数据层",
    "任务粒度均匀(S/M 为主),验收标准条条可判定",
    "并行组 g1(TASK-1.2/1.3)划得准:同依赖不同层,真可同时动"
  ],
  "critical_issues": [],
  "warnings": [
    "TASK-1.4 依赖 TASK-1.2 但展示 TASK-1.3 的校验错误——当前依赖未声明 1.3,行为上通过 1.2 的错误体间接获得,可接受;若校验错误形状变更需回看"
  ],
  "required_changes": [],
  "evidence_gaps": [],
  "confidence": "high"
}
